{
  "schema_version": "1.0",
  "batch_id": "HKA-W01-B02",
  "run_id": "HKA-W01-B02-R01",
  "prompt_commit_sha": "04da1831a597f22c7eab5737b9b674e545b71622",
  "manifest_sha256": "b015118db333be2d6a0c1f40a8326cfc573c256a1f18e9f6650826999b64cd65",
  "status": "BATCH_READY",
  "asset_total": 4,
  "asset_completed": 0,
  "asset_passed_self_qa": 0,
  "asset_failed_self_qa": 0,
  "blocked_asset_ids": [],
  "notes": "Prompt and manifest ready. Image production remains unauthorized until explicit handoff authorization and B00 calibration approval.",
  "updated_at": "2026-09-03T00:00:00Z"
}
